2025-01-25 13:37:11 INFO     Trial 6194 finished with value: 0.018501 and parameters: {'max_delta_step': 37.26395378450389, 'colsample_bytree': 0.9121679665646177, 'subsample': 0.9246742398753054, 'min_child_weight': 92.98497556417905, 'min_data_in_leaf': 70.5889294570824, 'lambda': 80.29912965663826, 'alpha': 92.68142384837182, 'max_depth': 2, 'eta': 0.19363756227547493, 'gamma': 4.332575798480562, 'num_boost_rounds': 80, 'grow_policy': 'lossguide'}. Best is trial 465 with value: 0.018785.
2025-01-25 13:37:12 INFO     Trial 6195 finished with value: 0.018501 and parameters: {'max_delta_step': 94.51954034289614, 'colsample_bytree': 0.9390060524277961, 'subsample': 0.8904665042256299, 'min_child_weight': 87.73327106379163, 'min_data_in_leaf': 68.61506325474848, 'lambda': 4.946018710820962, 'alpha': 89.05782501360586, 'max_depth': 2, 'eta': 0.18835463294949917, 'gamma': 4.900314640816865, 'num_boost_rounds': 90, 'grow_policy': 'depthwise'}. Best is trial 465 with value: 0.018785.
2025-01-25 13:37:14 INFO     Trial 6196 finished with value: 0.018501 and parameters: {'max_delta_step': 29.923663378273055, 'colsample_bytree': 0.8942980641525646, 'subsample': 0.9151847679583232, 'min_child_weight': 91.12044345296097, 'min_data_in_leaf': 71.54800119503116, 'lambda': 3.0061903048119802, 'alpha': 99.98654134885837, 'max_depth': 2, 'eta': 0.19605356661682874, 'gamma': 6.175039272169078, 'num_boost_rounds': 85, 'grow_policy': 'lossguide'}. Best is trial 465 with value: 0.018785.
2025-01-25 13:37:15 INFO     Trial 6197 finished with value: 0.018501 and parameters: {'max_delta_step': 32.907159363310356, 'colsample_bytree': 0.906511239292571, 'subsample': 0.9020849447525634, 'min_child_weight': 88.38546768617003, 'min_data_in_leaf': 66.67816985249452, 'lambda': 6.692291064521552, 'alpha': 95.76490386307339, 'max_depth': 2, 'eta': 0.19348294516841233, 'gamma': 5.183349200137904, 'num_boost_rounds': 85, 'grow_policy': 'lossguide'}. Best is trial 465 with value: 0.018785.
2025-01-25 13:37:16 INFO     Trial 6198 finished with value: 0.018501 and parameters: {'max_delta_step': 34.88834662234809, 'colsample_bytree': 0.8873543631850679, 'subsample': 0.9248890810141299, 'min_child_weight': 94.39335369995058, 'min_data_in_leaf': 69.86616945458113, 'lambda': 3.032867257428053, 'alpha': 13.69232708108347, 'max_depth': 2, 'eta': 0.19016362661785355, 'gamma': 5.8424136911330935, 'num_boost_rounds': 80, 'grow_policy': 'lossguide'}. Best is trial 465 with value: 0.018785.
2025-01-25 13:37:17 INFO     Trial 6199 finished with value: 0.018501 and parameters: {'max_delta_step': 26.12450667091827, 'colsample_bytree': 0.916990659739413, 'subsample': 0.9347374733794612, 'min_child_weight': 99.99308653740002, 'min_data_in_leaf': 68.05076127057895, 'lambda': 3.002435049375259, 'alpha': 96.78481776175401, 'max_depth': 2, 'eta': 0.1851947524414992, 'gamma': 3.5642732198456106, 'num_boost_rounds': 90, 'grow_policy': 'lossguide'}. Best is trial 465 with value: 0.018785.
