2025-01-25 13:36:11 INFO     Trial 6148 finished with value: 0.018501 and parameters: {'max_delta_step': 31.28668511941031, 'colsample_bytree': 0.9401766365043683, 'subsample': 0.9422939521428161, 'min_child_weight': 91.72263929914854, 'min_data_in_leaf': 70.51436348711835, 'lambda': 3.061052713347739, 'alpha': 94.65803913337629, 'max_depth': 2, 'eta': 0.19658526268441018, 'gamma': 4.135883843588092, 'num_boost_rounds': 90, 'grow_policy': 'lossguide'}. Best is trial 465 with value: 0.018785.
2025-01-25 13:36:12 INFO     Trial 6149 pruned. Trial was pruned at iteration 2.
2025-01-25 13:36:13 INFO     Trial 6150 finished with value: 0.018501 and parameters: {'max_delta_step': 35.98141181025332, 'colsample_bytree': 0.88331102795267, 'subsample': 0.9122431937687279, 'min_child_weight': 73.4212961562886, 'min_data_in_leaf': 69.49666295420637, 'lambda': 4.756872204622906, 'alpha': 95.58681211523566, 'max_depth': 2, 'eta': 0.19341651734594018, 'gamma': 6.328465746719972, 'num_boost_rounds': 85, 'grow_policy': 'depthwise'}. Best is trial 465 with value: 0.018785.
2025-01-25 13:36:14 INFO     Trial 6151 finished with value: 0.018501 and parameters: {'max_delta_step': 29.59117377370616, 'colsample_bytree': 0.9105480425190967, 'subsample': 0.7553665552004283, 'min_child_weight': 90.63312080124726, 'min_data_in_leaf': 71.86882792064867, 'lambda': 4.935952129481107, 'alpha': 98.20620962754586, 'max_depth': 2, 'eta': 0.19082602691841968, 'gamma': 5.707923707412879, 'num_boost_rounds': 80, 'grow_policy': 'lossguide'}. Best is trial 465 with value: 0.018785.
2025-01-25 13:36:16 INFO     Trial 6152 finished with value: 0.018501 and parameters: {'max_delta_step': 33.22483742512202, 'colsample_bytree': 0.919055845879479, 'subsample': 0.900837039497598, 'min_child_weight': 88.72124938195802, 'min_data_in_leaf': 78.20934987409179, 'lambda': 3.0214552879929366, 'alpha': 89.04319984479321, 'max_depth': 2, 'eta': 0.19660325335595352, 'gamma': 5.011301943772146, 'num_boost_rounds': 90, 'grow_policy': 'lossguide'}. Best is trial 465 with value: 0.018785.
2025-01-25 13:36:17 INFO     Trial 6153 finished with value: 0.018501 and parameters: {'max_delta_step': 34.42361542865004, 'colsample_bytree': 0.8988130787776674, 'subsample': 0.9617649153058487, 'min_child_weight': 92.68365670046937, 'min_data_in_leaf': 67.17838203324364, 'lambda': 6.686125131885266, 'alpha': 92.52773552193233, 'max_depth': 2, 'eta': 0.18534007917587036, 'gamma': 3.817588871498864, 'num_boost_rounds': 85, 'grow_policy': 'lossguide'}. Best is trial 465 with value: 0.018785.
2025-01-25 13:36:19 INFO     Trial 6154 finished with value: 0.018501 and parameters: {'max_delta_step': 13.069690557338404, 'colsample_bytree': 0.8886962467036238, 'subsample': 0.8816565581810154, 'min_child_weight': 86.62918105170277, 'min_data_in_leaf': 64.47816038506738, 'lambda': 5.015232410177877, 'alpha': 96.60031317126912, 'max_depth': 2, 'eta': 0.19313465979258404, 'gamma': 4.358402632256033, 'num_boost_rounds': 85, 'grow_policy': 'lossguide'}. Best is trial 465 with value: 0.018785.
2025-01-25 13:36:20 INFO     Trial 6155 finished with value: 0.018501 and parameters: {'max_delta_step': 38.109137763284274, 'colsample_bytree': 0.9063386242237474, 'subsample': 0.9242123354152596, 'min_child_weight': 91.55725429275195, 'min_data_in_leaf': 81.64641515677756, 'lambda': 10.277586456489399, 'alpha': 99.96341678744335, 'max_depth': 2, 'eta': 0.19678392264528616, 'gamma': 5.439854346694535, 'num_boost_rounds': 85, 'grow_policy': 'depthwise'}. Best is trial 465 with value: 0.018785.
2025-01-25 13:36:21 INFO     Trial 6156 pruned. Trial was pruned at iteration 0.
2025-01-25 13:36:22 INFO     Trial 6157 finished with value: 0.018501 and parameters: {'max_delta_step': 46.157689407162636, 'colsample_bytree': 0.8782014320396486, 'subsample': 0.936658273448568, 'min_child_weight': 87.96112959075923, 'min_data_in_leaf': 69.84241670396716, 'lambda': 8.299346012458429, 'alpha': 94.67894849710886, 'max_depth': 2, 'eta': 0.18822610192527717, 'gamma': 5.8529472684493316, 'num_boost_rounds': 75, 'grow_policy': 'lossguide'}. Best is trial 465 with value: 0.018785.
2025-01-25 13:36:23 INFO     Trial 6158 finished with value: 0.018501 and parameters: {'max_delta_step': 26.945323394124355, 'colsample_bytree': 0.9102149418668088, 'subsample': 0.9216532881579863, 'min_child_weight': 93.76356697986982, 'min_data_in_leaf': 66.20147291780586, 'lambda': 3.0171902256660594, 'alpha': 93.17604582418096, 'max_depth': 2, 'eta': 0.19113657716245092, 'gamma': 4.559868208632522, 'num_boost_rounds': 90, 'grow_policy': 'lossguide'}. Best is trial 465 with value: 0.018785.
2025-01-25 13:36:25 INFO     Trial 6159 finished with value: 0.018501 and parameters: {'max_delta_step': 35.6400436303684, 'colsample_bytree': 0.8955518152518619, 'subsample': 0.903686778269947, 'min_child_weight': 90.77064024976076, 'min_data_in_leaf': 70.94623356240922, 'lambda': 6.627549359044082, 'alpha': 97.1470758365447, 'max_depth': 2, 'eta': 0.19657203508657325, 'gamma': 5.312620278245251, 'num_boost_rounds': 85, 'grow_policy': 'lossguide'}. Best is trial 465 with value: 0.018785.
2025-01-25 13:36:26 INFO     Trial 6160 finished with value: 0.018501 and parameters: {'max_delta_step': 32.00340402925377, 'colsample_bytree': 0.9308660624646758, 'subsample': 0.8905109881592429, 'min_child_weight': 89.40988003280899, 'min_data_in_leaf': 68.39094328324128, 'lambda': 5.0711097613889, 'alpha': 91.50440433317314, 'max_depth': 2, 'eta': 0.19995389111240686, 'gamma': 4.147298637036961, 'num_boost_rounds': 80, 'grow_policy': 'depthwise'}. Best is trial 465 with value: 0.018785.
2025-01-25 13:36:28 INFO     Trial 6161 finished with value: 0.018501 and parameters: {'max_delta_step': 29.256851124878402, 'colsample_bytree': 0.9133673515638298, 'subsample': 0.9312775316870725, 'min_child_weight': 91.59108636854708, 'min_data_in_leaf': 69.87620515858652, 'lambda': 3.05916989865794, 'alpha': 98.4918997570572, 'max_depth': 2, 'eta': 0.1936746771776865, 'gamma': 5.0626754302412555, 'num_boost_rounds': 85, 'grow_policy': 'lossguide'}. Best is trial 465 with value: 0.018785.
2025-01-25 13:36:29 INFO     Trial 6162 finished with value: 0.018501 and parameters: {'max_delta_step': 33.662730767780154, 'colsample_bytree': 0.890376886904891, 'subsample': 0.9172748084678775, 'min_child_weight': 89.01423199429766, 'min_data_in_leaf': 67.29923808502399, 'lambda': 4.890600896793403, 'alpha': 95.6425338221678, 'max_depth': 2, 'eta': 0.18172837975613507, 'gamma': 4.6450260386136595, 'num_boost_rounds': 90, 'grow_policy': 'lossguide'}. Best is trial 465 with value: 0.018785.
2025-01-25 13:36:30 INFO     Trial 6163 finished with value: 0.018501 and parameters: {'max_delta_step': 31.40370553782075, 'colsample_bytree': 0.9022352125930156, 'subsample': 0.9094740065653386, 'min_child_weight': 87.46961237925157, 'min_data_in_leaf': 65.49266884547397, 'lambda': 5.076228447999583, 'alpha': 93.96830676769113, 'max_depth': 2, 'eta': 0.1999855356744156, 'gamma': 3.633111395885645, 'num_boost_rounds': 85, 'grow_policy': 'lossguide'}. Best is trial 465 with value: 0.018785.
2025-01-25 13:36:32 INFO     Trial 6164 finished with value: 0.018501 and parameters: {'max_delta_step': 37.43203796934034, 'colsample_bytree': 0.9187726441207222, 'subsample': 0.951727035359445, 'min_child_weight': 90.38115232082225, 'min_data_in_leaf': 68.7245762238947, 'lambda': 4.953335582895991, 'alpha': 96.87586719753979, 'max_depth': 2, 'eta': 0.19994947781942365, 'gamma': 12.351222091787886, 'num_boost_rounds': 85, 'grow_policy': 'lossguide'}. Best is trial 465 with value: 0.018785.
2025-01-25 13:36:34 INFO     Trial 6165 finished with value: 0.018501 and parameters: {'max_delta_step': 35.017365166774205, 'colsample_bytree': 0.9034783422492495, 'subsample': 0.8703773312762696, 'min_child_weight': 92.87495772978066, 'min_data_in_leaf': 72.24454471852074, 'lambda': 3.0555602079474187, 'alpha': 35.54807557019023, 'max_depth': 2, 'eta': 0.18856997128869718, 'gamma': 5.6719764199406875, 'num_boost_rounds': 90, 'grow_policy': 'depthwise'}. Best is trial 465 with value: 0.018785.
2025-01-25 13:36:35 INFO     Trial 6166 finished with value: 0.018501 and parameters: {'max_delta_step': 33.35464201390515, 'colsample_bytree': 0.8855890864675243, 'subsample': 0.9289126547077728, 'min_child_weight': 88.6072478733969, 'min_data_in_leaf': 70.38231011809896, 'lambda': 3.0202609636874844, 'alpha': 98.351045150273, 'max_depth': 2, 'eta': 0.19282089491742083, 'gamma': 4.253850801888247, 'num_boost_rounds': 60, 'grow_policy': 'lossguide'}. Best is trial 465 with value: 0.018785.
2025-01-25 13:36:36 INFO     Trial 6167 finished with value: 0.018501 and parameters: {'max_delta_step': 29.884600132083534, 'colsample_bytree': 0.8963140559864419, 'subsample': 0.8969767540689912, 'min_child_weight': 91.48578607713887, 'min_data_in_leaf': 67.71917652372858, 'lambda': 6.638976740953863, 'alpha': 95.44594634109266, 'max_depth': 2, 'eta': 0.19366381407221062, 'gamma': 4.971168372267102, 'num_boost_rounds': 85, 'grow_policy': 'lossguide'}. Best is trial 465 with value: 0.018785.
2025-01-25 13:36:38 INFO     Trial 6168 finished with value: 0.018501 and parameters: {'max_delta_step': 40.64003182378808, 'colsample_bytree': 0.9431791908985164, 'subsample': 0.9141331171006638, 'min_child_weight': 78.18377375691546, 'min_data_in_leaf': 69.23865808830446, 'lambda': 3.0227111435802474, 'alpha': 93.11152005353733, 'max_depth': 2, 'eta': 0.1999232959577811, 'gamma': 6.522339176045403, 'num_boost_rounds': 80, 'grow_policy': 'lossguide'}. Best is trial 465 with value: 0.018785.
2025-01-25 13:36:39 INFO     Trial 6169 finished with value: 0.018501 and parameters: {'max_delta_step': 27.62221172038561, 'colsample_bytree': 0.9152028647942697, 'subsample': 0.9418728413620775, 'min_child_weight': 90.56469631232395, 'min_data_in_leaf': 66.81682114248727, 'lambda': 43.298809765956634, 'alpha': 90.52480381487527, 'max_depth': 2, 'eta': 0.18664500856007407, 'gamma': 6.107860529323374, 'num_boost_rounds': 85, 'grow_policy': 'lossguide'}. Best is trial 465 with value: 0.018785.
2025-01-25 13:36:40 INFO     Trial 6170 finished with value: 0.018501 and parameters: {'max_delta_step': 36.090533513598885, 'colsample_bytree': 0.8610145997797422, 'subsample': 0.9045411037223241, 'min_child_weight': 85.38886729335609, 'min_data_in_leaf': 71.28303656891487, 'lambda': 8.564284103882116, 'alpha': 96.75425816097702, 'max_depth': 2, 'eta': 0.19660410513119173, 'gamma': 5.4333926728158675, 'num_boost_rounds': 85, 'grow_policy': 'depthwise'}. Best is trial 465 with value: 0.018785.
2025-01-25 13:36:42 INFO     Trial 6171 finished with value: 0.018501 and parameters: {'max_delta_step': 31.779023714570428, 'colsample_bytree': 0.9272980698693398, 'subsample': 0.9213516663670424, 'min_child_weight': 89.50351023309584, 'min_data_in_leaf': 60.20931504785207, 'lambda': 4.928735665417991, 'alpha': 98.34852392596967, 'max_depth': 2, 'eta': 0.19068439783460944, 'gamma': 4.540305970288238, 'num_boost_rounds': 75, 'grow_policy': 'lossguide'}. Best is trial 465 with value: 0.018785.
2025-01-25 13:36:43 INFO     Trial 6172 finished with value: 0.018501 and parameters: {'max_delta_step': 33.23007568155801, 'colsample_bytree': 0.875171744220748, 'subsample': 0.932153438157056, 'min_child_weight': 94.71386295554467, 'min_data_in_leaf': 68.43769966670024, 'lambda': 4.980978496087809, 'alpha': 86.16159807615406, 'max_depth': 2, 'eta': 0.19621022957712667, 'gamma': 3.8601533013018656, 'num_boost_rounds': 95, 'grow_policy': 'lossguide'}. Best is trial 465 with value: 0.018785.
2025-01-25 13:36:44 INFO     Trial 6173 finished with value: 0.018501 and parameters: {'max_delta_step': 68.58484453998415, 'colsample_bytree': 0.9062031850915726, 'subsample': 0.8833597561580057, 'min_child_weight': 55.28084187617175, 'min_data_in_leaf': 69.81616738057951, 'lambda': 4.929417400033072, 'alpha': 93.89812348432464, 'max_depth': 2, 'eta': 0.19335533922845338, 'gamma': 5.1816523513756305, 'num_boost_rounds': 80, 'grow_policy': 'lossguide'}. Best is trial 465 with value: 0.018785.
2025-01-25 13:36:45 INFO     Trial 6174 finished with value: 0.018501 and parameters: {'max_delta_step': 34.61772129508881, 'colsample_bytree': 0.8948289151663482, 'subsample': 0.9128536209277092, 'min_child_weight': 92.52075119271986, 'min_data_in_leaf': 66.3584619049293, 'lambda': 3.019258866398193, 'alpha': 95.40138385614311, 'max_depth': 2, 'eta': 0.19990387499200052, 'gamma': 4.734443464492342, 'num_boost_rounds': 80, 'grow_policy': 'lossguide'}. Best is trial 465 with value: 0.018785.
2025-01-25 13:36:47 INFO     Trial 6175 finished with value: 0.018501 and parameters: {'max_delta_step': 30.64054681623048, 'colsample_bytree': 0.9110663669915594, 'subsample': 0.8985131856339595, 'min_child_weight': 87.1922267051878, 'min_data_in_leaf': 67.66540713725306, 'lambda': 3.0294302090949996, 'alpha': 98.22015839324823, 'max_depth': 2, 'eta': 0.1893920619112379, 'gamma': 4.059505690527907, 'num_boost_rounds': 90, 'grow_policy': 'depthwise'}. Best is trial 465 with value: 0.018785.
2025-01-25 13:36:48 INFO     Trial 6176 finished with value: 0.018501 and parameters: {'max_delta_step': 37.60340246735385, 'colsample_bytree': 0.9715892401860898, 'subsample': 0.9271030328495709, 'min_child_weight': 90.21813013728345, 'min_data_in_leaf': 68.90373991066669, 'lambda': 7.005101973318967, 'alpha': 57.46878890705989, 'max_depth': 2, 'eta': 0.18563575456240036, 'gamma': 5.667126781196266, 'num_boost_rounds': 85, 'grow_policy': 'lossguide'}. Best is trial 465 with value: 0.018785.
2025-01-25 13:36:49 INFO     Trial 6177 finished with value: 0.018501 and parameters: {'max_delta_step': 23.94260535765903, 'colsample_bytree': 0.8835083952551339, 'subsample': 0.9199295678965675, 'min_child_weight': 88.51618336398893, 'min_data_in_leaf': 74.12160430764523, 'lambda': 4.917677420520498, 'alpha': 91.77607452447916, 'max_depth': 2, 'eta': 0.19379110716152909, 'gamma': 4.426520678313685, 'num_boost_rounds': 90, 'grow_policy': 'lossguide'}. Best is trial 465 with value: 0.018785.
2025-01-25 13:36:51 INFO     Trial 6178 finished with value: 0.018501 and parameters: {'max_delta_step': 32.5799429753997, 'colsample_bytree': 0.9588596187564383, 'subsample': 0.9047731554969282, 'min_child_weight': 92.00321101190187, 'min_data_in_leaf': 70.67860717860073, 'lambda': 6.549040478610001, 'alpha': 95.86581649802571, 'max_depth': 2, 'eta': 0.19674111795509316, 'gamma': 5.001146402023057, 'num_boost_rounds': 85, 'grow_policy': 'lossguide'}. Best is trial 465 with value: 0.018785.
2025-01-25 13:36:52 INFO     Trial 6179 finished with value: 0.018501 and parameters: {'max_delta_step': 34.5291555474506, 'colsample_bytree': 0.9204399569812364, 'subsample': 0.9432099112213393, 'min_child_weight': 89.7884132528896, 'min_data_in_leaf': 72.01756101236909, 'lambda': 10.42298758075446, 'alpha': 93.75441240121818, 'max_depth': 2, 'eta': 0.17833605264119715, 'gamma': 2.4055319426452404, 'num_boost_rounds': 80, 'grow_policy': 'lossguide'}. Best is trial 465 with value: 0.018785.
2025-01-25 13:36:54 INFO     Trial 6180 finished with value: 0.018501 and parameters: {'max_delta_step': 30.056272952391456, 'colsample_bytree': 0.900252664034911, 'subsample': 0.9129252568539841, 'min_child_weight': 91.54430953077281, 'min_data_in_leaf': 64.31464431124917, 'lambda': 6.649491459128106, 'alpha': 96.94386858036061, 'max_depth': 2, 'eta': 0.19064974892689493, 'gamma': 5.381173002850954, 'num_boost_rounds': 100, 'grow_policy': 'depthwise'}. Best is trial 465 with value: 0.018785.
2025-01-25 13:36:55 INFO     Trial 6181 finished with value: 0.018501 and parameters: {'max_delta_step': 28.710961101857933, 'colsample_bytree': 0.9899112910787887, 'subsample': 0.8876680442779376, 'min_child_weight': 88.55009939100877, 'min_data_in_leaf': 69.75929264941351, 'lambda': 8.473868358629886, 'alpha': 98.51323900114929, 'max_depth': 2, 'eta': 0.19997393350853487, 'gamma': 7.750599612917037, 'num_boost_rounds': 85, 'grow_policy': 'lossguide'}. Best is trial 465 with value: 0.018785.
2025-01-25 13:36:56 INFO     Trial 6182 finished with value: 0.018501 and parameters: {'max_delta_step': 32.06722466851527, 'colsample_bytree': 0.9999397552714414, 'subsample': 0.9238200692653303, 'min_child_weight': 93.63566376244502, 'min_data_in_leaf': 65.57257359262582, 'lambda': 3.0358820316908655, 'alpha': 26.09704045205557, 'max_depth': 2, 'eta': 0.18305079536294805, 'gamma': 3.3279823376936717, 'num_boost_rounds': 85, 'grow_policy': 'lossguide'}. Best is trial 465 with value: 0.018785.
2025-01-25 13:36:57 INFO     Trial 6183 finished with value: 0.018501 and parameters: {'max_delta_step': 35.59059080141299, 'colsample_bytree': 0.8898821983666609, 'subsample': 0.9361055144033107, 'min_child_weight': 90.7415626106396, 'min_data_in_leaf': 67.69873467502823, 'lambda': 3.025669925151966, 'alpha': 19.020417945922006, 'max_depth': 2, 'eta': 0.1938253525721402, 'gamma': 4.686900975669293, 'num_boost_rounds': 85, 'grow_policy': 'lossguide'}. Best is trial 465 with value: 0.018785.
2025-01-25 13:36:59 INFO     Trial 6184 finished with value: 0.018501 and parameters: {'max_delta_step': 33.68977701587197, 'colsample_bytree': 0.9101915366599092, 'subsample': 0.905783120231567, 'min_child_weight': 89.51693956544605, 'min_data_in_leaf': 69.04253511593802, 'lambda': 5.020101224961971, 'alpha': 94.6146020099475, 'max_depth': 2, 'eta': 0.1963832977157885, 'gamma': 5.90860503234776, 'num_boost_rounds': 90, 'grow_policy': 'lossguide'}. Best is trial 465 with value: 0.018785.
2025-01-25 13:37:00 INFO     Trial 6185 pruned. Trial was pruned at iteration 2.
2025-01-25 13:37:01 INFO     Trial 6186 finished with value: 0.018501 and parameters: {'max_delta_step': 36.15576292815892, 'colsample_bytree': 0.8989747415565706, 'subsample': 0.8957597250766953, 'min_child_weight': 67.1231793416337, 'min_data_in_leaf': 49.87720879822144, 'lambda': 3.026196791473116, 'alpha': 99.95906906161541, 'max_depth': 2, 'eta': 0.19996556692638842, 'gamma': 5.116974545875249, 'num_boost_rounds': 85, 'grow_policy': 'lossguide'}. Best is trial 465 with value: 0.018785.
2025-01-25 13:37:02 INFO     Trial 6187 finished with value: 0.018501 and parameters: {'max_delta_step': 30.99019141288431, 'colsample_bytree': 0.9179687948786738, 'subsample': 0.9279580812486776, 'min_child_weight': 87.86032163493354, 'min_data_in_leaf': 70.9439105338405, 'lambda': 3.002750875371236, 'alpha': 92.17200126413685, 'max_depth': 2, 'eta': 0.19105988947279529, 'gamma': 4.868927856859396, 'num_boost_rounds': 90, 'grow_policy': 'lossguide'}. Best is trial 465 with value: 0.018785.
2025-01-25 13:37:03 INFO     Trial 6188 finished with value: 0.018501 and parameters: {'max_delta_step': 32.401276825761826, 'colsample_bytree': 0.9063570992121384, 'subsample': 0.9093837953086797, 'min_child_weight': 91.42925464962704, 'min_data_in_leaf': 72.88955718410521, 'lambda': 6.653705276590111, 'alpha': 96.76338123772953, 'max_depth': 2, 'eta': 0.1935876513994781, 'gamma': 4.430209816485046, 'num_boost_rounds': 85, 'grow_policy': 'lossguide'}. Best is trial 465 with value: 0.018785.
2025-01-25 13:37:05 INFO     Trial 6189 finished with value: 0.018501 and parameters: {'max_delta_step': 18.44473459874112, 'colsample_bytree': 0.8698468049636499, 'subsample': 0.9182544091333814, 'min_child_weight': 89.89613609868402, 'min_data_in_leaf': 68.08404771690996, 'lambda': 11.779405460929528, 'alpha': 94.99537383496195, 'max_depth': 2, 'eta': 0.19616151840811585, 'gamma': 3.8228432745749394, 'num_boost_rounds': 80, 'grow_policy': 'lossguide'}. Best is trial 465 with value: 0.018785.
2025-01-25 13:37:06 INFO     Trial 6190 finished with value: 0.018501 and parameters: {'max_delta_step': 34.23196652530711, 'colsample_bytree': 0.8897667325575949, 'subsample': 0.8999321631713908, 'min_child_weight': 92.49437806294411, 'min_data_in_leaf': 69.82898635908904, 'lambda': 6.590267572460194, 'alpha': 93.48704667498603, 'max_depth': 2, 'eta': 0.19994930870593966, 'gamma': 5.482000290244777, 'num_boost_rounds': 85, 'grow_policy': 'depthwise'}. Best is trial 465 with value: 0.018785.
2025-01-25 13:37:07 INFO     Trial 6191 finished with value: 0.018501 and parameters: {'max_delta_step': 48.90041407065808, 'colsample_bytree': 0.9008809874577521, 'subsample': 0.9353232578160035, 'min_child_weight': 88.91330130429084, 'min_data_in_leaf': 68.7534279797344, 'lambda': 5.0146242714989855, 'alpha': 96.96803967978653, 'max_depth': 2, 'eta': 0.18574494640217512, 'gamma': 7.1354971956608875, 'num_boost_rounds': 90, 'grow_policy': 'lossguide'}. Best is trial 465 with value: 0.018785.
2025-01-25 13:37:09 INFO     Trial 6192 finished with value: 0.018501 and parameters: {'max_delta_step': 27.894992863627497, 'colsample_bytree': 0.8798390580126131, 'subsample': 0.9501954956296446, 'min_child_weight': 90.83102595251998, 'min_data_in_leaf': 67.23461019205553, 'lambda': 8.55920381450342, 'alpha': 98.34922504987672, 'max_depth': 2, 'eta': 0.1908664596123314, 'gamma': 4.762210775738661, 'num_boost_rounds': 85, 'grow_policy': 'lossguide'}. Best is trial 465 with value: 0.018785.
2025-01-25 13:37:10 INFO     Trial 6193 finished with value: 0.018501 and parameters: {'max_delta_step': 43.27158355111596, 'colsample_bytree': 0.9220353406463196, 'subsample': 0.9102887219070324, 'min_child_weight': 89.80318826883973, 'min_data_in_leaf': 65.58993429325305, 'lambda': 5.0833804621434435, 'alpha': 95.42441233683857, 'max_depth': 2, 'eta': 0.1963835361672726, 'gamma': 5.3497226172190135, 'num_boost_rounds': 85, 'grow_policy': 'lossguide'}. Best is trial 465 with value: 0.018785.
