2025-01-25 13:35:06 INFO     Trial 6096 finished with value: 0.018501 and parameters: {'max_delta_step': 35.35263688875964, 'colsample_bytree': 0.880340444772598, 'subsample': 0.9082167907984217, 'min_child_weight': 92.26176956553344, 'min_data_in_leaf': 70.71224792846755, 'lambda': 5.078276673782678, 'alpha': 81.67300808829086, 'max_depth': 2, 'eta': 0.19996336978779733, 'gamma': 5.629523411446727, 'num_boost_rounds': 85, 'grow_policy': 'lossguide'}. Best is trial 465 with value: 0.018785.
2025-01-25 13:35:06 INFO     Trial 6097 pruned. Trial was pruned at iteration 2.
2025-01-25 13:35:08 INFO     Trial 6098 pruned. Trial was pruned at iteration 2.
2025-01-25 13:35:09 INFO     Trial 6099 finished with value: 0.018501 and parameters: {'max_delta_step': 66.31585381178527, 'colsample_bytree': 0.8930764649564987, 'subsample': 0.9164121145005559, 'min_child_weight': 82.20032341737357, 'min_data_in_leaf': 69.61070656525844, 'lambda': 6.685970791484492, 'alpha': 99.96054980897043, 'max_depth': 2, 'eta': 0.19143219034263542, 'gamma': 6.0111491203550225, 'num_boost_rounds': 80, 'grow_policy': 'depthwise'}. Best is trial 465 with value: 0.018785.
2025-01-25 13:35:10 INFO     Trial 6100 finished with value: 0.018501 and parameters: {'max_delta_step': 28.714167220057544, 'colsample_bytree': 0.924301696470811, 'subsample': 0.9551046768316753, 'min_child_weight': 88.95527243081985, 'min_data_in_leaf': 71.04633388238307, 'lambda': 4.875457716146771, 'alpha': 97.3501091467565, 'max_depth': 2, 'eta': 0.17719315349318948, 'gamma': 3.9555330326241753, 'num_boost_rounds': 85, 'grow_policy': 'lossguide'}. Best is trial 465 with value: 0.018785.
2025-01-25 13:35:11 INFO     Trial 6101 finished with value: 0.018501 and parameters: {'max_delta_step': 36.18948568973581, 'colsample_bytree': 0.9030850228525265, 'subsample': 0.900413378814198, 'min_child_weight': 91.30842291380162, 'min_data_in_leaf': 79.64810827827274, 'lambda': 24.06623091623154, 'alpha': 92.67539210752689, 'max_depth': 2, 'eta': 0.19999276728364743, 'gamma': 6.493855863648133, 'num_boost_rounds': 90, 'grow_policy': 'lossguide'}. Best is trial 465 with value: 0.018785.
2025-01-25 13:35:13 INFO     Trial 6102 finished with value: 0.018501 and parameters: {'max_delta_step': 38.76488960761377, 'colsample_bytree': 0.833229856594773, 'subsample': 0.880120031561652, 'min_child_weight': 87.92027493289218, 'min_data_in_leaf': 68.11802990122314, 'lambda': 8.374839116582299, 'alpha': 95.29049481877664, 'max_depth': 2, 'eta': 0.18468573143606926, 'gamma': 5.2780747857595935, 'num_boost_rounds': 50, 'grow_policy': 'lossguide'}. Best is trial 465 with value: 0.018785.
2025-01-25 13:35:14 INFO     Trial 6103 finished with value: 0.018501 and parameters: {'max_delta_step': 33.38179878470233, 'colsample_bytree': 0.9145647751961031, 'subsample': 0.9340860169077616, 'min_child_weight': 90.00906925375865, 'min_data_in_leaf': 66.26117463881023, 'lambda': 5.037526005150644, 'alpha': 97.1181286362942, 'max_depth': 2, 'eta': 0.19380916282012814, 'gamma': 4.760787244325486, 'num_boost_rounds': 30, 'grow_policy': 'lossguide'}. Best is trial 465 with value: 0.018785.
2025-01-25 13:35:16 INFO     Trial 6104 finished with value: 0.018501 and parameters: {'max_delta_step': 30.867287960457123, 'colsample_bytree': 0.8859341112731335, 'subsample': 0.9186693970802102, 'min_child_weight': 86.75641892778013, 'min_data_in_leaf': 69.5044113322817, 'lambda': 3.019069525271214, 'alpha': 74.42606266503773, 'max_depth': 2, 'eta': 0.188425539333779, 'gamma': 0.3526336617300032, 'num_boost_rounds': 85, 'grow_policy': 'depthwise'}. Best is trial 465 with value: 0.018785.
2025-01-25 13:35:17 INFO     Trial 6105 finished with value: 0.018501 and parameters: {'max_delta_step': 34.6726168868184, 'colsample_bytree': 0.8978573955877274, 'subsample': 0.8916274423269731, 'min_child_weight': 44.9574822962028, 'min_data_in_leaf': 68.40598373735838, 'lambda': 6.617338726931578, 'alpha': 98.2469835486958, 'max_depth': 2, 'eta': 0.19607352345684534, 'gamma': 0.03318187241947812, 'num_boost_rounds': 80, 'grow_policy': 'lossguide'}. Best is trial 465 with value: 0.018785.
2025-01-25 13:35:18 INFO     Trial 6106 finished with value: 0.018501 and parameters: {'max_delta_step': 27.610943061696037, 'colsample_bytree': 0.9066223194834893, 'subsample': 0.903528282608496, 'min_child_weight': 91.76218039040148, 'min_data_in_leaf': 71.757216154565, 'lambda': 4.957211631368487, 'alpha': 90.80808644140423, 'max_depth': 2, 'eta': 0.1936896078151952, 'gamma': 4.356572410326708, 'num_boost_rounds': 85, 'grow_policy': 'lossguide'}. Best is trial 465 with value: 0.018785.
2025-01-25 13:35:20 INFO     Trial 6107 finished with value: 0.018501 and parameters: {'max_delta_step': 16.849853610900322, 'colsample_bytree': 0.9215628660408449, 'subsample': 0.9260976794350878, 'min_child_weight': 89.15089442021154, 'min_data_in_leaf': 67.33549590007316, 'lambda': 49.27605687298816, 'alpha': 99.98184728076153, 'max_depth': 2, 'eta': 0.19049114204312148, 'gamma': 5.451691313980475, 'num_boost_rounds': 85, 'grow_policy': 'lossguide'}. Best is trial 465 with value: 0.018785.
2025-01-25 13:35:21 INFO     Trial 6108 finished with value: 0.018501 and parameters: {'max_delta_step': 10.01204574785568, 'colsample_bytree': 0.8921684952822506, 'subsample': 0.9108717517481122, 'min_child_weight': 85.04861847608248, 'min_data_in_leaf': 70.42220898647231, 'lambda': 3.0123620328835075, 'alpha': 95.6713322543326, 'max_depth': 2, 'eta': 0.18127654397744083, 'gamma': 4.950362310641767, 'num_boost_rounds': 25, 'grow_policy': 'lossguide'}. Best is trial 465 with value: 0.018785.
2025-01-25 13:35:22 INFO     Trial 6109 finished with value: 0.018501 and parameters: {'max_delta_step': 31.56677286008129, 'colsample_bytree': 0.936550100041442, 'subsample': 0.9212423410602985, 'min_child_weight': 90.49021485051162, 'min_data_in_leaf': 64.99463141000396, 'lambda': 6.730403875863992, 'alpha': 29.24889560091825, 'max_depth': 2, 'eta': 0.19648582097490894, 'gamma': 6.9419258296511535, 'num_boost_rounds': 90, 'grow_policy': 'depthwise'}. Best is trial 465 with value: 0.018785.
2025-01-25 13:35:23 INFO     Trial 6110 finished with value: 0.018501 and parameters: {'max_delta_step': 22.513730173501486, 'colsample_bytree': 0.8772644719261202, 'subsample': 0.900470836959929, 'min_child_weight': 92.49646157808343, 'min_data_in_leaf': 69.12283996008065, 'lambda': 4.781054751623602, 'alpha': 93.18195886507793, 'max_depth': 2, 'eta': 0.1964617637622703, 'gamma': 4.448251521807508, 'num_boost_rounds': 80, 'grow_policy': 'lossguide'}. Best is trial 465 with value: 0.018785.
2025-01-25 13:35:25 INFO     Trial 6111 finished with value: 0.018501 and parameters: {'max_delta_step': 29.512869009631135, 'colsample_bytree': 0.909034143116812, 'subsample': 0.9371726116442319, 'min_child_weight': 88.32865034103021, 'min_data_in_leaf': 67.80491030112188, 'lambda': 3.0191360178426034, 'alpha': 97.01295410515266, 'max_depth': 2, 'eta': 0.18687629383947021, 'gamma': 4.0010339315231205, 'num_boost_rounds': 85, 'grow_policy': 'lossguide'}. Best is trial 465 with value: 0.018785.
2025-01-25 13:35:26 INFO     Trial 6112 finished with value: 0.018501 and parameters: {'max_delta_step': 37.00327410110067, 'colsample_bytree': 0.8978797388259265, 'subsample': 0.9126169852896233, 'min_child_weight': 89.72817354736456, 'min_data_in_leaf': 66.21281784800043, 'lambda': 6.676457494978321, 'alpha': 93.90211502318981, 'max_depth': 2, 'eta': 0.19162906932146334, 'gamma': 5.872390247673813, 'num_boost_rounds': 75, 'grow_policy': 'lossguide'}. Best is trial 465 with value: 0.018785.
2025-01-25 13:35:27 INFO     Trial 6113 pruned. Trial was pruned at iteration 2.
2025-01-25 13:35:28 INFO     Trial 6114 pruned. Trial was pruned at iteration 2.
2025-01-25 13:35:29 INFO     Trial 6115 finished with value: 0.018501 and parameters: {'max_delta_step': 35.86178393174015, 'colsample_bytree': 0.8851152692011287, 'subsample': 0.8878245499233113, 'min_child_weight': 90.81289667299019, 'min_data_in_leaf': 67.27465063344432, 'lambda': 4.890803094320676, 'alpha': 98.31874684816131, 'max_depth': 2, 'eta': 0.19620459068962498, 'gamma': 3.761164433647485, 'num_boost_rounds': 85, 'grow_policy': 'lossguide'}. Best is trial 465 with value: 0.018785.
2025-01-25 13:35:30 INFO     Trial 6116 finished with value: 0.018501 and parameters: {'max_delta_step': 33.90151385753317, 'colsample_bytree': 0.9094554529536083, 'subsample': 0.908357506120181, 'min_child_weight': 93.28493576941601, 'min_data_in_leaf': 72.40048126173232, 'lambda': 3.0340638570119287, 'alpha': 87.75680908436223, 'max_depth': 2, 'eta': 0.18873241533242696, 'gamma': 5.407987583127123, 'num_boost_rounds': 85, 'grow_policy': 'lossguide'}. Best is trial 465 with value: 0.018785.
2025-01-25 13:35:31 INFO     Trial 6117 pruned. Trial was pruned at iteration 2.
2025-01-25 13:35:33 INFO     Trial 6118 finished with value: 0.018501 and parameters: {'max_delta_step': 31.925927894191823, 'colsample_bytree': 0.925990906288547, 'subsample': 0.9183911818275267, 'min_child_weight': 89.4560173290978, 'min_data_in_leaf': 68.5782125559532, 'lambda': 95.46574582574334, 'alpha': 94.12404790092204, 'max_depth': 2, 'eta': 0.19108305427537434, 'gamma': 4.498382343036631, 'num_boost_rounds': 85, 'grow_policy': 'lossguide'}. Best is trial 465 with value: 0.018785.
2025-01-25 13:35:34 INFO     Trial 6119 finished with value: 0.018501 and parameters: {'max_delta_step': 37.70604895079411, 'colsample_bytree': 0.8945174722691317, 'subsample': 0.8612565442340447, 'min_child_weight': 90.70661020938942, 'min_data_in_leaf': 71.33721813002397, 'lambda': 3.0072551820570848, 'alpha': 95.79721239400573, 'max_depth': 2, 'eta': 0.18332529837192998, 'gamma': 5.022246118900382, 'num_boost_rounds': 95, 'grow_policy': 'depthwise'}. Best is trial 465 with value: 0.018785.
2025-01-25 13:35:35 INFO     Trial 6120 finished with value: 0.018501 and parameters: {'max_delta_step': 35.36427177657699, 'colsample_bytree': 0.9138375882108207, 'subsample': 0.8967247287670262, 'min_child_weight': 86.38792331654543, 'min_data_in_leaf': 55.29507768856639, 'lambda': 4.903473600980121, 'alpha': 92.90787869291096, 'max_depth': 2, 'eta': 0.19389004997041098, 'gamma': 6.273213844660214, 'num_boost_rounds': 70, 'grow_policy': 'lossguide'}. Best is trial 465 with value: 0.018785.
2025-01-25 13:35:37 INFO     Trial 6121 finished with value: 0.018501 and parameters: {'max_delta_step': 32.948214399283955, 'colsample_bytree': 0.9029493396149234, 'subsample': 0.928739126982892, 'min_child_weight': 88.92131166634191, 'min_data_in_leaf': 65.73326204165508, 'lambda': 4.964757402835848, 'alpha': 96.76992060918342, 'max_depth': 2, 'eta': 0.18763674982508408, 'gamma': 4.196749077356317, 'num_boost_rounds': 85, 'grow_policy': 'lossguide'}. Best is trial 465 with value: 0.018785.
2025-01-25 13:35:38 INFO     Trial 6122 finished with value: 0.018501 and parameters: {'max_delta_step': 27.330596961119227, 'colsample_bytree': 0.880617070355836, 'subsample': 0.8422114765660883, 'min_child_weight': 91.64700995604127, 'min_data_in_leaf': 68.02452466028564, 'lambda': 6.744548713318269, 'alpha': 98.11317859947137, 'max_depth': 2, 'eta': 0.19640668634065192, 'gamma': 5.421792855473321, 'num_boost_rounds': 80, 'grow_policy': 'lossguide'}. Best is trial 465 with value: 0.018785.
2025-01-25 13:35:39 INFO     Trial 6123 finished with value: 0.018501 and parameters: {'max_delta_step': 30.47017165503855, 'colsample_bytree': 0.9332316407035143, 'subsample': 0.9066001250888946, 'min_child_weight': 89.99751031435987, 'min_data_in_leaf': 74.44419788675987, 'lambda': 10.475641079699873, 'alpha': 89.10016783578017, 'max_depth': 2, 'eta': 0.1917693527471814, 'gamma': 4.785766196141844, 'num_boost_rounds': 90, 'grow_policy': 'lossguide'}. Best is trial 465 with value: 0.018785.
2025-01-25 13:35:40 INFO     Trial 6124 finished with value: 0.018501 and parameters: {'max_delta_step': 39.69799529113072, 'colsample_bytree': 0.8902992341581937, 'subsample': 0.9174496329699423, 'min_child_weight': 87.7323319215451, 'min_data_in_leaf': 69.51367249576967, 'lambda': 3.033669318129915, 'alpha': 93.875843055566, 'max_depth': 2, 'eta': 0.1941307759071368, 'gamma': 5.845225593927447, 'num_boost_rounds': 85, 'grow_policy': 'lossguide'}. Best is trial 465 with value: 0.018785.
2025-01-25 13:35:41 INFO     Trial 6125 pruned. Trial was pruned at iteration 0.
2025-01-25 13:35:42 INFO     Trial 6126 finished with value: 0.018501 and parameters: {'max_delta_step': 31.911327268256127, 'colsample_bytree': 0.984184426205326, 'subsample': 0.9215273058515957, 'min_child_weight': 90.71573520998783, 'min_data_in_leaf': 70.34667396609298, 'lambda': 4.885141314457563, 'alpha': 98.36161422261246, 'max_depth': 2, 'eta': 0.19076169182029878, 'gamma': 5.113940728222645, 'num_boost_rounds': 85, 'grow_policy': 'lossguide'}. Best is trial 465 with value: 0.018785.
2025-01-25 13:35:44 INFO     Trial 6127 finished with value: 0.018501 and parameters: {'max_delta_step': 35.769059954011006, 'colsample_bytree': 0.9207252242979682, 'subsample': 0.8982154107964944, 'min_child_weight': 88.968635259776, 'min_data_in_leaf': 73.4131086729589, 'lambda': 8.213758033732834, 'alpha': 91.926543206198, 'max_depth': 2, 'eta': 0.1846863149974312, 'gamma': 3.5059213170398635, 'num_boost_rounds': 85, 'grow_policy': 'lossguide'}. Best is trial 465 with value: 0.018785.
2025-01-25 13:35:45 INFO     Trial 6128 pruned. Trial was pruned at iteration 2.
2025-01-25 13:35:46 INFO     Trial 6129 finished with value: 0.018501 and parameters: {'max_delta_step': 33.36468730503198, 'colsample_bytree': 0.9128648758716791, 'subsample': 0.8765566753192747, 'min_child_weight': 89.88670407457668, 'min_data_in_leaf': 71.14423353542242, 'lambda': 90.31456948581001, 'alpha': 53.972291693753085, 'max_depth': 2, 'eta': 0.19999243123929641, 'gamma': 5.534144471605325, 'num_boost_rounds': 85, 'grow_policy': 'depthwise'}. Best is trial 465 with value: 0.018785.
2025-01-25 13:35:48 INFO     Trial 6130 finished with value: 0.018501 and parameters: {'max_delta_step': 31.809375219273996, 'colsample_bytree': 0.869470117667472, 'subsample': 0.9094740198460713, 'min_child_weight': 86.96991276258476, 'min_data_in_leaf': 64.6012214160006, 'lambda': 6.7537427583843535, 'alpha': 95.74570409360811, 'max_depth': 2, 'eta': 0.19647268911277938, 'gamma': 4.648480394993784, 'num_boost_rounds': 80, 'grow_policy': 'lossguide'}. Best is trial 465 with value: 0.018785.
2025-01-25 13:35:49 INFO     Trial 6131 finished with value: 0.018501 and parameters: {'max_delta_step': 28.84413302123012, 'colsample_bytree': 0.9023045843862931, 'subsample': 0.9303321841336283, 'min_child_weight': 90.97548093079006, 'min_data_in_leaf': 66.9241010785488, 'lambda': 4.87613728766099, 'alpha': 94.40604831337834, 'max_depth': 2, 'eta': 0.18800421392786873, 'gamma': 5.090778223677224, 'num_boost_rounds': 85, 'grow_policy': 'lossguide'}. Best is trial 465 with value: 0.018785.
2025-01-25 13:35:50 INFO     Trial 6132 finished with value: 0.018501 and parameters: {'max_delta_step': 37.09758647154523, 'colsample_bytree': 0.8936288645834947, 'subsample': 0.9138857887910872, 'min_child_weight': 88.29747154965858, 'min_data_in_leaf': 69.49426473273179, 'lambda': 26.163121620097144, 'alpha': 98.24912072369233, 'max_depth': 2, 'eta': 0.19377586115438167, 'gamma': 4.31438943467727, 'num_boost_rounds': 90, 'grow_policy': 'lossguide'}. Best is trial 465 with value: 0.018785.
2025-01-25 13:35:51 INFO     Trial 6133 pruned. Trial was pruned at iteration 2.
2025-01-25 13:35:53 INFO     Trial 6134 finished with value: 0.018501 and parameters: {'max_delta_step': 87.83532901665396, 'colsample_bytree': 0.8559077424361301, 'subsample': 0.9031201657574711, 'min_child_weight': 92.26414032332109, 'min_data_in_leaf': 65.77440991360213, 'lambda': 6.7972560438402, 'alpha': 96.87516653150287, 'max_depth': 2, 'eta': 0.19105393408908938, 'gamma': 4.729208339022255, 'num_boost_rounds': 85, 'grow_policy': 'depthwise'}. Best is trial 465 with value: 0.018785.
2025-01-25 13:35:54 INFO     Trial 6135 finished with value: 0.018501 and parameters: {'max_delta_step': 35.58207027659237, 'colsample_bytree': 0.9043332269672006, 'subsample': 0.9494365635385988, 'min_child_weight': 90.97706150642661, 'min_data_in_leaf': 70.19176901358564, 'lambda': 8.833606518428049, 'alpha': 92.86199561323181, 'max_depth': 2, 'eta': 0.19638102156388168, 'gamma': 11.35436425512705, 'num_boost_rounds': 85, 'grow_policy': 'lossguide'}. Best is trial 465 with value: 0.018785.
2025-01-25 13:35:56 INFO     Trial 6136 finished with value: 0.018501 and parameters: {'max_delta_step': 41.9881451242271, 'colsample_bytree': 0.8821904915627631, 'subsample': 0.9243789669883533, 'min_child_weight': 88.53257278530558, 'min_data_in_leaf': 71.80042353836865, 'lambda': 4.798978023420193, 'alpha': 59.82047134489124, 'max_depth': 2, 'eta': 0.1935183027826379, 'gamma': 5.25330143278062, 'num_boost_rounds': 90, 'grow_policy': 'lossguide'}. Best is trial 465 with value: 0.018785.
2025-01-25 13:35:57 INFO     Trial 6137 finished with value: 0.018501 and parameters: {'max_delta_step': 31.070824299954413, 'colsample_bytree': 0.9316322811645034, 'subsample': 0.9380235652618522, 'min_child_weight': 93.79604804954202, 'min_data_in_leaf': 68.64353510788939, 'lambda': 3.0098918007458204, 'alpha': 95.46241359499666, 'max_depth': 2, 'eta': 0.18808693903505622, 'gamma': 3.75247485206159, 'num_boost_rounds': 85, 'grow_policy': 'lossguide'}. Best is trial 465 with value: 0.018785.
2025-01-25 13:35:58 INFO     Trial 6138 finished with value: 0.018501 and parameters: {'max_delta_step': 32.81364540871814, 'colsample_bytree': 0.8948860514857176, 'subsample': 0.9165609021961337, 'min_child_weight': 90.20511998925699, 'min_data_in_leaf': 66.7914948491334, 'lambda': 5.036927007053334, 'alpha': 98.38231739526404, 'max_depth': 2, 'eta': 0.19649584913420332, 'gamma': 8.245376807267677, 'num_boost_rounds': 80, 'grow_policy': 'lossguide'}. Best is trial 465 with value: 0.018785.
2025-01-25 13:35:59 INFO     Trial 6139 finished with value: 0.018501 and parameters: {'max_delta_step': 20.03307268058773, 'colsample_bytree': 0.9186608838087429, 'subsample': 0.8949932554351151, 'min_child_weight': 72.19205914285259, 'min_data_in_leaf': 76.39205112043491, 'lambda': 4.991529605787868, 'alpha': 94.03202350470386, 'max_depth': 2, 'eta': 0.18068563324466533, 'gamma': 4.153908357674432, 'num_boost_rounds': 85, 'grow_policy': 'depthwise'}. Best is trial 465 with value: 0.018785.
2025-01-25 13:36:00 INFO     Trial 6140 pruned. Trial was pruned at iteration 2.
2025-01-25 13:36:02 INFO     Trial 6141 finished with value: 0.018501 and parameters: {'max_delta_step': 34.71368111056609, 'colsample_bytree': 0.8883185201729055, 'subsample': 0.9068585115718313, 'min_child_weight': 85.84888708220659, 'min_data_in_leaf': 68.14151137320526, 'lambda': 3.049829406280993, 'alpha': 95.51421597508775, 'max_depth': 2, 'eta': 0.19123354348551866, 'gamma': 2.74371737122524, 'num_boost_rounds': 85, 'grow_policy': 'lossguide'}. Best is trial 465 with value: 0.018785.
2025-01-25 13:36:02 INFO     Trial 6142 pruned. Trial was pruned at iteration 0.
2025-01-25 13:36:04 INFO     Trial 6143 finished with value: 0.018501 and parameters: {'max_delta_step': 30.39347058402062, 'colsample_bytree': 0.9253345236003021, 'subsample': 0.5929040627222681, 'min_child_weight': 87.41023899800507, 'min_data_in_leaf': 62.95605862291503, 'lambda': 6.654152973254176, 'alpha': 98.50648250245794, 'max_depth': 2, 'eta': 0.19652692908338726, 'gamma': 4.456408159249704, 'num_boost_rounds': 85, 'grow_policy': 'lossguide'}. Best is trial 465 with value: 0.018785.
2025-01-25 13:36:05 INFO     Trial 6144 finished with value: 0.018501 and parameters: {'max_delta_step': 32.92994518780814, 'colsample_bytree': 0.8717817587067413, 'subsample': 0.9160679377910907, 'min_child_weight': 95.38968905696586, 'min_data_in_leaf': 72.92452611078151, 'lambda': 6.384752895801067, 'alpha': 97.30286785376312, 'max_depth': 2, 'eta': 0.19371219422459524, 'gamma': 5.425885976309392, 'num_boost_rounds': 90, 'grow_policy': 'depthwise'}. Best is trial 465 with value: 0.018785.
2025-01-25 13:36:07 INFO     Trial 6145 finished with value: 0.018501 and parameters: {'max_delta_step': 28.405323949804412, 'colsample_bytree': 0.914709822501759, 'subsample': 0.905219080403345, 'min_child_weight': 92.74272185248358, 'min_data_in_leaf': 67.44669228288106, 'lambda': 3.0146153117896013, 'alpha': 94.22951318666057, 'max_depth': 2, 'eta': 0.1964106221259278, 'gamma': 4.831366857593349, 'num_boost_rounds': 85, 'grow_policy': 'lossguide'}. Best is trial 465 with value: 0.018785.
2025-01-25 13:36:08 INFO     Trial 6146 finished with value: 0.018501 and parameters: {'max_delta_step': 36.80682280473548, 'colsample_bytree': 0.8190301353927667, 'subsample': 0.9323314252430638, 'min_child_weight': 90.29510664063193, 'min_data_in_leaf': 69.00406527079758, 'lambda': 4.877607852764918, 'alpha': 90.94729299615103, 'max_depth': 2, 'eta': 0.19074855948786762, 'gamma': 3.2894813084876215, 'num_boost_rounds': 80, 'grow_policy': 'lossguide'}. Best is trial 465 with value: 0.018785.
2025-01-25 13:36:10 INFO     Trial 6147 finished with value: 0.018501 and parameters: {'max_delta_step': 34.55755850976421, 'colsample_bytree': 0.8944007530162336, 'subsample': 0.9219431062370108, 'min_child_weight': 88.1342265353858, 'min_data_in_leaf': 66.08001419361707, 'lambda': 8.431827300863782, 'alpha': 96.78832935425677, 'max_depth': 2, 'eta': 0.1876345389900152, 'gamma': 5.202171166115357, 'num_boost_rounds': 85, 'grow_policy': 'lossguide'}. Best is trial 465 with value: 0.018785.
